gender,product_category,product_name,details,category_type,combined_features,text,weather_label
women,TROUSERS,satin cargo trouser,highwaist trouser viscose pocket patch pocket flap side buckle tab pleat adjustable hem elastic drawstring stopper zip metal hook fasten,Bottom,satin viscose trouser,satin viscose trouser satin cargo trouser,10-15°C cool weather
women,TROUSERS,linen blend straight trouser,highwaist trouser linen blend fabric adjustable elasticate waistband drawstre pocket false welt pocket wideleg design,Bottom,linen trouser,linen trouser linen blend straight trouser,10-15°C cool weather
women,TROUSERS,straight fit trouser,highwaist trouser feature pocket false welt pocket zip inside button metal hook fasten,Bottom,trouser,trouser straight fit trouser,10-15°C cool weather
women,TROUSERS,satin trouser topstitching,highwaist trouser pocket pronounce contrast topstitching detail straight leg fray hem invisible zip fastening,Bottom,satin trouser,satin trouser satin trouser topstitching,10-15°C cool weather
women,TROUSERS,animal print paperbag trouser,highwaist trouser dart matching belt pocket straightleg design zip fly interior button metal hook fasten,Bottom,belt trouser,belt trouser animal print paperbag trouser,10-15°C cool weather
women,TROUSERS,parachute trouser,midwaist trouser elasticate waist pocket adjustable hem stopper,Bottom,trouser,trouser parachute trouser,10-15°C cool weather
women,TROUSERS,satin parachute trouser,midrise trouser feature elasticate waistband drawstring stopper pocket patch pocket pleated detail leg adjustable hem elasticate drawstring stopper,Bottom,satin trouser,satin trouser satin parachute trouser,10-15°C cool weather
women,TROUSERS,wash effect trouser,fade lowrise trouser elasticate waistband pocket wideleg design,Bottom,trouser,trouser wash effect trouser,rain
women,TROUSERS,flow wideleg trouser,highwaist trouser elastic waistband pocket wideleg design,Bottom,trouser,trouser flow wideleg trouser,10-15°C cool weather
women,TROUSERS,fadedeffect plush trouser,fade cotton trouser feature elasticate drawstring waistband seamless hem,Bottom,cotton trouser,cotton trouser fadedeffect plush trouser,10-15°C cool weather
women,TROUSERS,linen blend palazzo trouser,midrise wideleg trouser cotton linen blend feature elasticate waistband adjustable drawstring pocket texture fabric detail,Bottom,cotton linen trouser,cotton linen trouser linen blend palazzo trouser,10-15°C cool weather
women,TROUSERS,cargo trouser strap,midrise trouser cotton belt loop belt fabric adjustable metal buckle pocket patch pocket flap zips leg patch pocket adjustable contrast strap metal buckle pleat knee adjustable hem elastic drawstring stopper zip button fastening,Bottom,cotton belt trouser,cotton belt trouser cargo trouser strap,10-15°C cool weather
women,TROUSERS,carrot fit trouser dart detail,midwaist trouser viscose blend belt loop pocket rear welt pocket dart detail pleated hem contrast button zip fly button fastening,Bottom,viscose belt trouser,viscose belt trouser carrot fit trouser dart detail,10-15°C cool weather
women,TROUSERS,minimalist palazzo trouser,semisheer trouser viscose blend elasticate waistband pocket hide seam line wide leg,Bottom,semisheer viscose trouser,semisheer viscose trouser minimalist palazzo trouser,10-15°C cool weather
women,TROUSERS,linen palazzo trouser,highwaist trouser linen elasticate waist adjustable drawstring pocket wideleg design,Bottom,linen trouser,linen trouser linen palazzo trouser,10-15°C cool weather
women,TROUSERS,fray linen trouser,trouser linen midrise belt loop pocket straightleg design fray hem fabric zip button fastening,Bottom,linen belt trouser,linen belt trouser fray linen trouser,10-15°C cool weather
women,TROUSERS,linen wideleg trouser,highwaist trouser linen dart pocket patch pocket wideleg design zip fly button fastening,Bottom,linen trouser,linen trouser linen wideleg trouser,10-15°C cool weather
women,TROUSERS,loosefitte dart trouser,highwaist trouser dart elastic pocket wideleg design fasten zip fly inside button metal hook,Bottom,trouser,trouser loosefitte dart trouser,10-15°C cool weather
women,TROUSERS,length flare trouser,midwaist trouser feature pocket rear false welt pocket flare hem zip fly interior button metal hook fasten,Bottom,trouser,trouser length flare trouser,10-15°C cool weather
women,TROUSERS,highwaist carrot fit trouser belt,highwaist trouser dart inseam pocket match belt metal buckle zip interior button metal hook fasten,Bottom,belt trouser,belt trouser highwaist carrot fit trouser belt,10-15°C cool weather
women,TROUSERS,bootcut trouser,midrise trouser feature pocket false welt pocket fitted leg flare hem zip fly interior button metal hook fasten,Bottom,trouser,trouser bootcut trouser,10-15°C cool weather
women,TROUSERS,stripe rustic trouser,highwaist trouser feature elastic waistband adjustable drawstring pocket wideleg design,Bottom,trouser,trouser stripe rustic trouser,10-15°C cool weather
women,TROUSERS,straightleg trouser turnup hem,highwaist trouser pocket false welt pocket straightleg design turnup hem zip fly inside button metal hook fasten,Bottom,trouser,trouser straightleg trouser turnup hem,10-15°C cool weather
women,TROUSERS,cargo trf trouser,midrise trouser pocket patch pocket leg belt loop zip fly metal button fastening,Bottom,belt trouser,belt trouser cargo trf trouser,10-15°C cool weather
women,TROUSERS,animal print flare trouser,flow highwaist trouser flare hem zip fly inside button metal hook fasten,Bottom,trouser,trouser animal print flare trouser,10-15°C cool weather
women,TROUSERS,wideleg trouser satin waistband,highwaist trouser pleated detail satin fabric wideleg design invisible zip fastening,Bottom,satin trouser,satin trouser wideleg trouser satin waistband,10-15°C cool weather
women,TROUSERS,flow cropped trouser,midwaist trouser elasticate drawstre waistband pocket patch pocket,Bottom,trouser cropped,trouser cropped flow cropped trouser,10-15°C cool weather
women,TROUSERS,cropped trouser,highwaist crop trouser elasticate waistband drawstre dart pocket,Bottom,trouser crop cropped,trouser crop cropped cropped trouser,10-15°C cool weather
women,TROUSERS,nylon trouser pocket,midrise trouser feature elasticate waistband pocket patch pocket leg pleated detail knee adjustable hem stopper,Bottom,nylon trouser,nylon trouser nylon trouser pocket,10-15°C cool weather
women,TROUSERS,linen blend pareostyle trouser,highwaist trouser linen blend crossover pareostyle snap button false rear welt pocket wideleg design invisible zip fastening,Bottom,linen trouser,linen trouser linen blend pareostyle trouser,10-15°C cool weather
women,TROUSERS,length pinstripe trouser,highwaist trouser feature pocket false rear welt pocket pleated detail zip fly interior button metal hook fasten,Bottom,trouser,trouser length pinstripe trouser,10-15°C cool weather
women,TROUSERS,straight fit trouser,highwaist trouser pocket false rear welt pocket straightleg design zip fly inside button metal hook fasten,Bottom,trouser,trouser straight fit trouser,10-15°C cool weather
women,TROUSERS,satin trouser zips,highwaist trouser belt loop pocket patch pocket leg false rear welt pocket gather detail knee adjustable hem elastic drawstring stopper fastening metal zip,Bottom,satin belt trouser,satin belt trouser satin trouser zips,10-15°C cool weather
women,TROUSERS,contrast linen blend trouser,midrise trouser linen blend contrast waistband pocket zip button metal hook fasten,Bottom,linen trouser,linen trouser contrast linen blend trouser,10-15°C cool weather
women,TROUSERS,midrise cargo trouser,midrise trouser pocket patch pocket leg flap detail zip fly metallic button fastening,Bottom,trouser,trouser midrise cargo trouser,10-15°C cool weather
women,TROUSERS,print pyjama bottom,semisheer midrise trouser viscose adjustable drawstre waistband pocket wideleg design,Bottom,semisheer viscose trouser,semisheer viscose trouser print pyjama bottom,10-15°C cool weather
women,TROUSERS,belt fulllength trouser,highwaist trouser inseam pocket flap pocket belt fabric metal buckle dart detail hem contrast button zip inside button fastening,Bottom,belt trouser,belt trouser belt fulllength trouser,10-15°C cool weather
women,TROUSERS,cargo trouser lace trim,midrise trouser elasticate waistband belt loop pocket patch pocket flap pleat detail knee adjustable hem elastic drawstring stopper zip fly button fastening,Bottom,belt trouser,belt trouser cargo trouser lace trim,10-15°C cool weather
women,TROUSERS,soft wideleg trouser,highwaist trouser elastic waistband wideleg design seamless hem,Bottom,trouser,trouser soft wideleg trouser,10-15°C cool weather
women,TROUSERS,straight fit satin trouser,midrise trouser pocket straightleg design zip fly inside button metal hook fasten,Bottom,satin trouser,satin trouser straight fit satin trouser,10-15°C cool weather
women,TROUSERS,carrot fit trouser,highwaist trouser dart pocket false welt pocket hem tab button zip fly button fastening,Bottom,trouser,trouser carrot fit trouser,10-15°C cool weather
women,TROUSERS,tiedye print flare trouser,highwaist trouser flare hem invisible zip fastening,Bottom,trouser,trouser tiedye print flare trouser,10-15°C cool weather
women,TROUSERS,linen wideleg trouser,highwaist trouser linen fabric pocket false welt pocket straightleg design zip fly button fastening,Bottom,linen trouser,linen trouser linen wideleg trouser,10-15°C cool weather
women,TROUSERS,wrap trouser waist detail,highwaist wrap trouser invisible zip button fasten,Bottom,trouser,trouser wrap trouser waist detail,10-15°C cool weather
women,TROUSERS,parachute trouser,midrise trouser feature elasticate waistband pocket patch pocket leg zip fly metal button fastening,Bottom,trouser,trouser parachute trouser,10-15°C cool weather
women,TROUSERS,jogger trouser,highwaist crop trouser feature elastic waistband drawstre pocket rear patch pocket,Bottom,trouser crop,trouser crop jogger trouser,10-15°C cool weather
women,TROUSERS,embroider cargo trouser,midrise trouser elasticate waistband belt loop pocket patch pocket flap leg adjustable hem elastic drawstring stopper zip fly button fastening,Bottom,belt trouser,belt trouser embroider cargo trouser,10-15°C cool weather
women,TROUSERS,print cargo trouser,midrise trouser cotton feature belt loop pocket multiple patch pocket flap metal zip wideleg design fasten metal hook button zip fly,Bottom,cotton belt trouser,cotton belt trouser print cargo trouser,10-15°C cool weather
women,TROUSERS,highwaist regular trouser,flow highwaist trouser straightleg design invisible zip fastening,Bottom,trouser,trouser highwaist regular trouser,10-15°C cool weather
women,SHORTS_SKORTS,z crossover skort button,highwaist skort crossover pocket rear patch pocket seamless hem fasten hidden zip button,Bottom,skort,skort z crossover skort button,5-10°C cold weather
women,SHORTS_SKORTS,z baggy belt denim bermuda short,highwaist bermuda short elasticate waistband gathering feature pocket rear patch pocket belt turnup hem zip fly button fasten,Bottom,denim belt bermuda denim short short,denim belt bermuda denim short short z baggy belt denim bermuda short,10-15°C cool weather
women,SHORTS_SKORTS,bermuda short cutwork embroidery,highwaist bermuda short elasticate waistband pocket patch pocket,Bottom,bermuda short short,bermuda short short bermuda short cutwork embroidery,10-15°C cool weather
women,SHORTS_SKORTS,texture short,midwaist short feature adjustable elastic drawstre waistband pocket button detail,Bottom,short short,short short texture short,10-15°C cool weather
women,SHORTS_SKORTS,trf highrise mom fit denim bermuda short,highrise mom fithighrise bermuda short fivepocket design zip fly metal button fasten turnup hem,Bottom,denim bermuda denim short short,denim bermuda denim short short trf highrise mom fit denim bermuda short,10-15°C cool weather
women,SHORTS_SKORTS,pleated highwaist bermuda short,highwaist bermuda short dart pocket rear false flap pocket zip fly interior button metal hook fasten,Bottom,bermuda short short,bermuda short short pleated highwaist bermuda short,10-15°C cool weather
women,SHORTS_SKORTS,embroider short,highwaist short linen blend contrast embroidery invisible zip fastening,Bottom,linen short short,linen short short embroider short,10-15°C cool weather
women,SHORTS_SKORTS,trf curve highwaist short,highrise curvedhighrise rigid short fivepocket design rip detail zip metallic button fastening,Bottom,short short,short short trf curve highwaist short,10-15°C cool weather
women,SHORTS_SKORTS,skort,highwaist skort layered wrap detail match fabric invisible zip fastening,Bottom,skort,skort skort,5-10°C cold weather
women,SHORTS_SKORTS,short cutwork embroidery,highwaist short patch pocket match cutwork embroidery detail invisible zip fastening,Bottom,short short,short short short cutwork embroidery,10-15°C cool weather
women,SHORTS_SKORTS,skort slit detail,highwaist skort feature slit invisible zip fastening,Bottom,skort,skort skort slit detail,5-10°C cold weather
women,SHORTS_SKORTS,asymmetric skort,find,Bottom,skort,skort asymmetric skort,10-15°C cool weather
women,SHORTS_SKORTS,box pleat skort,highwaist skort pleat false golden button invisible zip fastening,Bottom,box skort,box skort box pleat skort,10-15°C cool weather
women,SHORTS_SKORTS,linen blend bermuda short elastic waistband,highwaist bermuda short linen blend fabric adjustable elasticate waistband drawstring pocket,Bottom,linen bermuda short short,linen bermuda short short linen blend bermuda short elastic waistband,10-15°C cool weather
women,SHORTS_SKORTS,asymmetric skort,highwaist skort false welt pocket layered wrap detail match fabric invisible zip fastening,Bottom,skort,skort asymmetric skort,10-15°C cool weather
women,SHORTS_SKORTS,skort slit detail,highwaist skort slit invisible zip fastening,Bottom,skort,skort skort slit detail,5-10°C cold weather
women,SHORTS_SKORTS,skort belt,highwaist skort belt detail fabric lined buckle hem vent invisible zip fastening,Bottom,belt skort,belt skort skort belt,10-15°C cool weather
women,SHORTS_SKORTS,embroider short,midrise short cotton contrast cutwork embroidery invisible zip fastening,Bottom,cotton short short,cotton short short embroider short,10-15°C cool weather
women,SHORTS_SKORTS,skort bow,highwaist skort matching bow ruffle hem invisible zip fastening,Bottom,bow skort,bow skort skort bow,10-15°C cool weather
women,SHORTS_SKORTS,highwaist trf denim short,high waist frayedhighwaist short pocket fade effect rip detail fray hem metal button fastening,Bottom,denim denim short short,denim denim short short highwaist trf denim short,10-15°C cool weather
women,SHORTS_SKORTS,cargo skort belt,midrise skort patch pocket detail invisible zip fastening belt metal buckle,Bottom,belt skort,belt skort cargo skort belt,10-15°C cool weather
women,SHORTS_SKORTS,doublefabric bermuda short belt,highwaist bermuda short dart faux leather belt pocket false welt pocket zip fly interior button metal hook fasten,Bottom,faux leather belt bermuda short short,faux leather belt bermuda short short doublefabric bermuda short belt,10-15°C cool weather
women,SHORTS_SKORTS,trf highwaist denim patchwork short,highwaist short pocket rip detail seamless hem zip fly metallic button fastening,Bottom,denim denim short short,denim denim short short trf highwaist denim patchwork short,10-15°C cool weather
women,SHORTS_SKORTS,linen blend skort,highwaist skort linen blend pocket false welt pocket zip fly inside button metal hook fasten,Bottom,linen skort,linen skort linen blend skort,10-15°C cool weather
women,SHORTS_SKORTS,linen bermuda short belt loop,midrise bermuda short linen feature elasticate waistband belt loop pocket dart,Bottom,linen belt bermuda short short,linen belt bermuda short short linen bermuda short belt loop,10-15°C cool weather
women,SHORTS_SKORTS,linen blend highwaist bermuda short,highwaist bermuda short linen blend fabric dart pocket false flap pocket zip fly interior button metal hook fasten,Bottom,linen bermuda short short,linen bermuda short short linen blend highwaist bermuda short,10-15°C cool weather
women,SHORTS_SKORTS,ruffle skort,highwaist mini skirt ruffle invisible zip fastening,Bottom,skirt skort mini,skirt skort mini ruffle skort,10-15°C cool weather
women,SHORTS_SKORTS,trf highwaist denim short,fade highwaist short feature fivepocket design belt loop rip detail fray hem button fastening hide placket,Bottom,denim belt denim short short,denim belt denim short short trf highwaist denim short,10-15°C cool weather
women,SHORTS_SKORTS,linen blend bermuda short,highwaist bermuda short linen blend fabric pocket rear welt pocket zip fly interior button metal hook fasten,Bottom,linen bermuda short short,linen bermuda short short linen blend bermuda short,10-15°C cool weather
women,SHORTS_SKORTS,animal print skort,highwaist skort ruffle trim detail invisible zip fastening,Bottom,skort,skort animal print skort,10-15°C cool weather
women,SHORTS_SKORTS,z denim momfit highwaist short,highwaist short pocket turnup hem zip fly metal button fastening,Bottom,denim denim short short,denim denim short short z denim momfit highwaist short,10-15°C cool weather
women,SHORTS_SKORTS,long pleated bermuda short,long highwaist bermuda short belt loop pocket pleated detail zip inside button metal hook fasten,Bottom,belt bermuda short long short,belt bermuda short long short long pleated bermuda short,10-15°C cool weather
women,SHORTS_SKORTS,wax skort,skort wax fabric midrise box pleat false pocket zip fly metal button fastening,Bottom,box skort,box skort wax skort,5-10°C cold weather
women,SHORTS_SKORTS,box pleat skort,midrise mini skirt shortstyle lining box pleat detail belt match fabric metal buckle invisible zip fastening,Bottom,belt box skirt skort mini,belt box skirt skort mini box pleat skort,10-15°C cool weather
women,SHORTS_SKORTS,midrise trf denim short,midrise frayedmidrise short pocket fade effect rip detail fray hem metal button fastening,Bottom,denim denim short short,denim denim short short midrise trf denim short,10-15°C cool weather
women,SHORTS_SKORTS,trf highwaist metallic short,highwaist short pocket metalliceffect fabric fray hem zip fly metal button fastening,Bottom,short short,short short trf highwaist metallic short,10-15°C cool weather
women,SHORTS_SKORTS,crossover rustic skort,highwaist skort cotton crossover false button invisible zip fastening,Bottom,cotton skort,cotton skort crossover rustic skort,10-15°C cool weather
women,SHORTS_SKORTS,skort button,highwaist skort pleat false button invisible zip fastening,Bottom,skort,skort skort button,5-10°C cold weather
women,SHORTS_SKORTS,paperbag bermuda short turnup hem,highwaist bermuda short feature elasticate waistband gather dart pocket rear patch pocket turnup hem button fastening,Bottom,bermuda short short,bermuda short short paperbag bermuda short turnup hem,10-15°C cool weather
women,SHORTS_SKORTS,skort pocket,midwaist skort feature pocket patch pocket zip fly snapbutton fasten,Bottom,skort,skort skort pocket,5-10°C cold weather
women,SHORTS_SKORTS,linen blend belt bermuda short,bermuda short linen blend high waist belt match fabric patch pocket flap turnup hem zip fly interior button metal hook fasten,Bottom,linen belt bermuda short short,linen belt bermuda short short linen blend belt bermuda short,10-15°C cool weather
women,SHORTS_SKORTS,trf midrise denim bermuda short patch,patch midrisemidrise denim bermuda short,Bottom,denim bermuda denim short short,denim bermuda denim short short trf midrise denim bermuda short patch,10-15°C cool weather
women,SHORTS_SKORTS,dart highwaist bermuda short,highwaist bermuda short dart detail pocket rear false flap pocket zip fly interior button metal hook fasten,Bottom,bermuda short short,bermuda short short dart highwaist bermuda short,10-15°C cool weather
women,SHORTS_SKORTS,z rip denim short,highwaist gather short fivepocket design washedeffect seamless split hem rip zip fly metallic button fastening,Bottom,denim denim short short,denim denim short short z rip denim short,10-15°C cool weather
women,SHORTS_SKORTS,trf highwaist cargo short,highwaist short belt loop patch pocket tab detail zip fly metal button fastening,Bottom,belt short short,belt short short trf highwaist cargo short,10-15°C cool weather
women,SHORTS_SKORTS,z denim skort crossover,highwaist skort pocket fade effect crossover fasten inner fly metal button,Bottom,denim denim skort,denim denim skort z denim skort crossover,10-15°C cool weather
women,SHORTS_SKORTS,short contrast stripe,midwaist short elasticate waistband button detail,Bottom,short short,short short short contrast stripe,10-15°C cool weather
women,SHORTS_SKORTS,linen blend belt bermuda short,highwaist bermuda short linen blend fabric dart pocket zip fly interior button metal hook fasten,Bottom,linen belt bermuda short short,linen belt bermuda short short linen blend belt bermuda short,10-15°C cool weather
women,SHORTS_SKORTS,short cutwork embroidery,highwaist short elastic drawstre waistband cutwork embroidery detail scallop hem,Bottom,short short,short short short cutwork embroidery,10-15°C cool weather
women,SHORTS_SKORTS,trf denim midrise rhinestone short,midrise fade short fivepocket rhinestone appliqué fray hem metal button fly fasten,Bottom,denim denim short short,denim denim short short trf denim midrise rhinestone short,10-15°C cool weather
women,SHORTS_SKORTS,midi pareo bermuda short,highwaist pareo bermuda short vent invisible zip fastening,Bottom,bermuda short midi short,bermuda short midi short midi pareo bermuda short,10-15°C cool weather
women,SHORTS_SKORTS,loose fit denim trf bermuda short,midrise bermuda short midrise bermuda short feature fivepocket design rip detail seamless hem zip fly metal button fastening,Bottom,denim bermuda denim short short,denim bermuda denim short short loose fit denim trf bermuda short,10-15°C cool weather
women,SHORTS_SKORTS,skort pocket,midwaist skort adjustable elasticate waistband drawstring stopper patch pocket,Bottom,skort,skort skort pocket,5-10°C cold weather
women,SHORTS_SKORTS,linen blend highwaist bermuda short,highwaist bermuda short linen blend dart pocket false flap pocket zip fly inside button metal hook fasten,Bottom,linen bermuda short short,linen bermuda short short linen blend highwaist bermuda short,10-15°C cool weather
women,SHORTS_SKORTS,stripe poplin short,midrise short feature adjustable elastic waist tie detail pocket rear welt pocket hem vent button,Bottom,poplin short short,poplin short short stripe poplin short,10-15°C cool weather
women,SHORTS_SKORTS,skort pocket,midrise skort pocket patch pocket flap detail zip fly fasten,Bottom,skort,skort skort pocket,5-10°C cold weather
women,SHORTS_SKORTS,embroider short,midrise short viscose blend adjustable elasticate waistband drawstring contrast embroidery detail,Bottom,viscose short short,viscose short short embroider short,10-15°C cool weather
women,JEANS,marine straight fit highwaist pocket jean,slim fit relaxed leg high waistzw woman jeanshighwaist jean belt loop patch pocket contrast visible topstitche detail seamless hem zip fly button fastening,Bottom,belt jean,belt jean marine straight fit highwaist pocket jean,10-15°C cool weather
women,JEANS,marine straightleg highwaist jean,slim fit relaxed leg high waistzw woman jeanshighwaist jean patch pocket seamless hem zip fly button fastening,Bottom,jean,jean marine straightleg highwaist jean,10-15°C cool weather
women,JEANS,trf wideleg midrise metallic jean,midrise widelegmidrise jean pocket metalliceffect fabric zip fly metal button fastening,Bottom,jean,jean trf wideleg midrise metallic jean,10-15°C cool weather
women,JEANS,trf highwaist metallic jean,high waist loose fithighwaist jean pocket metalliceffect fabric zip fly metallic button fastening,Bottom,jean,jean trf highwaist metallic jean,10-15°C cool weather
women,JEANS,midrise flare crop trf jean,crop midrisemidrise jean pocket seamless crop flare hem zip fly metal button fastening,Bottom,jean crop,jean crop midrise flare crop trf jean,10-15°C cool weather
women,JEANS,z flare highwaist jean,highrise flarefade highrise jean fivepocket design flare hem zip fly metal button fastening,Bottom,jean,jean z flare highwaist jean,10-15°C cool weather
women,JEANS,z wide leg highrise jean,high waist wide leghighwaist jean feature false welt pocket rear patch pocket wideleg design zip fly button fastening,Bottom,jean,jean z wide leg highrise jean,10-15°C cool weather
women,JEANS,z straightfit highwaist length jean,highwaist jean pocket fade effect straight extralong leg zip fly metallic button fastening,Bottom,jean,jean z straightfit highwaist length jean,10-15°C cool weather
women,JEANS,z highwaist mini flare jean,highwaist mini flarefaded highwaist jean pocket flare seamless hem zip fly button fastening,Bottom,jean mini,jean mini z highwaist mini flare jean,10-15°C cool weather
women,JEANS,z highrise straight jean,highwaist straight rigidhighwaist jean fivepocket design fade effect iron crease detail straight leg zip fly button fastening,Bottom,jean,jean z highrise straight jean,10-15°C cool weather
women,JEANS,z flare highwaist jean,highwaist flarefade highwaist jean fivepocket design iron crease detail flare hem zip fly metal button fastening,Bottom,jean,jean z flare highwaist jean,10-15°C cool weather
women,JEANS,highrise skinny sculpt trf jean,high waist skinny ankle lengthhighwaist super stretch jean fivepocket design zip fly metal button fastening,Bottom,jean,jean highrise skinny sculpt trf jean,10-15°C cool weather
women,JEANS,z straightfit highwaist long length jean,highwaist regular reg long length rigid highwaist jean pocket fade effect straightleg longleg design zip fly button fastening,Bottom,jean long longleg,jean long longleg z straightfit highwaist long length jean,10-15°C cool weather
