gender,product_category,product_name,details,category_type,combined_features,text,weather_label
women,JEANS,midrise trf cargo jean,cargo midrisemidrise jean pocket patch pocket leg belt loop zip fly metal button fastening,Bottom,belt jean,belt jean midrise trf cargo jean,10-15°C cool weather
women,JEANS,z highwaist baggy paperbag jean,highrise baggy paperbag carrot leg ankle rigidhighwaist jean elasticate waistband gather detail feature pocket rear patch pocket turnup hem zip button fasten,Bottom,jean,jean z highwaist baggy paperbag jean,10-15°C cool weather
women,JEANS,marine straight fit highwaist pocket jean,slim fit relaxed leg high waistzw woman jeanshighwaist jean belt loop patch pocket contrast visible topstitche detail seamless hem zip fly button fasteningview,Bottom,belt jean,belt jean marine straight fit highwaist pocket jean,10-15°C cool weather
women,JEANS,marine straightleg highwaist jean,slim fit relaxed leg high waistzw woman jeanshighwaist jean patch pocket seamless hem zip fly button fasteningview,Bottom,jean,jean marine straightleg highwaist jean,10-15°C cool weather
women,TROUSERS,belt chino trouser,highwaist trouser dart pocket button false welt pocket zip fly button fasten embossed belt detail,Bottom,belt chino trouser,belt chino trouser belt chino trouser,10-15°C cool weather
women,TROUSERS,carrot fit trouser dart detail,midwaist trouser viscose blend belt loop pocket rear welt pocket dart detail pleated hem contrast button zip fly button fastening,Bottom,viscose belt trouser,viscose belt trouser carrot fit trouser dart detail,10-15°C cool weather
women,JEANS,straightleg midrise crop jean,slim fit straight leg midrisezw woman jeansmidrise fade jean belt loop fivepocket design zip fly metal button fasteningview,Bottom,belt jean crop,belt jean crop straightleg midrise crop jean,10-15°C cool weather
women,SKIRTS,long satin skirt limited edition,highwaist long skirt viscose fabric asymmetric hem tail invisible zip fastening,Bottom,satin viscose skirt long,satin viscose skirt long long satin skirt limited edition,10-15°C cool weather
women,TROUSERS,length flare trouser,highwaist trouser pocket false welt pocket flare hem zip fly interior button metal hook fasten,Bottom,trouser,trouser length flare trouser,10-15°C cool weather
women,TROUSERS,highwaist trouser,highwaist trouser seam detail welt pocket zip fly inside button metal hook fasten,Bottom,trouser,trouser highwaist trouser,10-15°C cool weather
women,JEANS,z straightfit highwaist length jean,highwaist jean pocket fade effect straight extralong leg zip fly metallic button fastening,Bottom,jean,jean z straightfit highwaist length jean,10-15°C cool weather
women,JEANS,z flare highwaist jean,highrise flarefade highrise jean fivepocket design flare hem zip fly metal button fastening,Bottom,jean,jean z flare highwaist jean,10-15°C cool weather
women,SHORTS_SKORTS,pleated highwaist bermuda short,highwaist bermuda short dart pocket rear false flap pocket zip fly interior button metal hook fasten,Bottom,bermuda short short,bermuda short short pleated highwaist bermuda short,10-15°C cool weather
women,TROUSERS,straightleg trouser turnup hem,highwaist trouser feature pocket rear false welt pocket straightleg design turnup hem zip fly interior button metal hook fasten,Bottom,trouser,trouser straightleg trouser turnup hem,10-15°C cool weather
women,TROUSERS,straightleg trouser turnup hem,highwaist trouser pocket false welt pocket straightleg design turnup hem zip fly inside button metal hook fasten,Bottom,trouser,trouser straightleg trouser turnup hem,10-15°C cool weather
women,TROUSERS,straight fit trouser button,highwaist trouser elastic waistband pocket decorative golden button false welt pocket straightleg design,Bottom,trouser,trouser straight fit trouser button,10-15°C cool weather
women,TROUSERS,paperbag trouser belt,highwaist trouser dart pocket patch pocket flap adjustable hem button fasten zip fly interior button metal hook fasten belt buckle metal stud,Bottom,belt trouser,belt trouser paperbag trouser belt,10-15°C cool weather
women,TROUSERS,highwaist regular trouser,flow highwaist trouser straightleg design invisible zip fastening,Bottom,trouser,trouser highwaist regular trouser,10-15°C cool weather
women,TROUSERS,long flow trouser,loosefitte highwaist trouser straightleg design invisible zip fastening,Bottom,trouser long,trouser long long flow trouser,10-15°C cool weather
women,TROUSERS,highwaist wideleg trouser,highwaist trouser viscose blend wideleg design invisible zip fastening,Bottom,viscose trouser,viscose trouser highwaist wideleg trouser,10-15°C cool weather
women,TROUSERS,highwaiste straight cut trouser,highwaist trouser pocket rear welt pocket straightleg design zip fly button metal hook fasten,Bottom,trouser,trouser highwaiste straight cut trouser,10-15°C cool weather
women,TROUSERS,wideleg poplin trouser,midrise trouser cotton elasticate waistband adjustable drawstring inseam pocket wideleg design,Bottom,cotton poplin trouser,cotton poplin trouser wideleg poplin trouser,10-15°C cool weather
women,TROUSERS,doublewaist linen blend trouser,highwaist trouser linen blend double waistband matching fabric belt loop pocket rear welt pocket straight leg zip button fastening,Bottom,linen belt trouser,linen belt trouser doublewaist linen blend trouser,10-15°C cool weather
women,TROUSERS,linenblend flare trouser,midrise trouser lyocell linen blend belt loop pocket zip button fastening,Bottom,linen lyocell belt trouser,linen lyocell belt trouser linenblend flare trouser,10-15°C cool weather
women,TROUSERS,highwaist culotte trouser,highwaist trouser feature pocket rear welt pocket short wide leg design zip fly interior button metal hook fasten,Bottom,short trouser short,short trouser short highwaist culotte trouser,10-15°C cool weather
women,TROUSERS,carrot fit trouser,highwaist trouser dart pocket false welt pocket hem tab button zip fly button fastening,Bottom,trouser,trouser carrot fit trouser,10-15°C cool weather
women,TROUSERS,dart wideleg trouser,highwaist trouser dart pocket rear false welt pocket wideleg design zip fly interior button metal hook fasten,Bottom,trouser,trouser dart wideleg trouser,10-15°C cool weather
women,TROUSERS,length trouser,highwaist trouser feature pocket false rear welt pocket pleated detail zip fly interior button metal hook fasten,Bottom,trouser,trouser length trouser,10-15°C cool weather
women,SKIRTS,midi skirt belt,highwaist skirt belt loop false belt metal clip invisible zip fastening,Bottom,belt skirt midi,belt skirt midi midi skirt belt,10-15°C cool weather
women,SKIRTS,knit midi skirt,highwaist skirt feature elastic waistband vent hem,Bottom,knit skirt knit midi,knit skirt knit midi knit midi skirt,10-15°C cool weather
women,TROUSERS,texture jacquard trouser,highwaist trouser adjustable waistband matching drawstring texture jacquard fabric detail wideleg design,Bottom,trouser,trouser texture jacquard trouser,10-15°C cool weather
women,TROUSERS,straight fit knit trouser,highwaist trouser elastic waistband straightleg design,Bottom,knit trouser knit,knit trouser knit straight fit knit trouser,10-15°C cool weather
women,TROUSERS,straight fit trouser,highwaist trouser pocket false rear pocket straightleg design zip fly interior button metal hook fasten,Bottom,trouser,trouser straight fit trouser,10-15°C cool weather
women,TROUSERS,linen palazzo trouser,highwaist trouser linen elasticate waist adjustable drawstring pocket wideleg design,Bottom,linen trouser,linen trouser linen palazzo trouser,10-15°C cool weather
women,SKIRTS,linen blend midi skirt,midrise midi skirt linen blend flare hem invisible zip fastening,Bottom,linen skirt midi,linen skirt midi linen blend midi skirt,10-15°C cool weather
women,TROUSERS,casual straightleg trouser,midrise trouser cotton blend belt loop pocket rear welt pocket button straightleg design zip fly button metal hook fasten,Bottom,cotton belt trouser,cotton belt trouser casual straightleg trouser,10-15°C cool weather
women,TROUSERS,flow cargo trouser,midrise flow trouser feature adjustable elastic waistband drawstring patch pocket flap pocket contrast visible topstitche detail,Bottom,trouser,trouser flow cargo trouser,10-15°C cool weather
women,TROUSERS,culotte topstitching detail,highwaist trouser cotton blend fabric belt loop match visible topstitching detail wideleg design zip fly button fastening,Bottom,cotton belt trouser,cotton belt trouser culotte topstitching detail,10-15°C cool weather
women,SKIRTS,linen wrap skirt,midrise midi skirt linen contrast pronounce topstitching detail fray trim wrapstyle fasten tie fabric,Bottom,linen skirt midi,linen skirt midi linen wrap skirt,10-15°C cool weather
women,TROUSERS,minimalist wideleg satin trouser,midwaist trouser viscose elasticate waistband adjustable drawstring pocket wideleg design,Bottom,satin viscose trouser,satin viscose trouser minimalist wideleg satin trouser,10-15°C cool weather
women,JEANS,trf mom fit highwaist jean,highwaist ankle lengthfade highwaist jean fivepocket design zip fly metal button fastening,Bottom,jean,jean trf mom fit highwaist jean,10-15°C cool weather
women,SKIRTS,knit midi skirt,midi skirt wool alpaca blend feature elastic highwaist waistband slit hem,Bottom,alpaca knit wool skirt knit midi,alpaca knit wool skirt knit midi knit midi skirt,10-15°C cool weather
women,SKIRTS,knit midi skirt metallic thread,highwaist skirt elastic waistband slit hem metallic thread detail,Bottom,knit skirt knit midi,knit skirt knit midi knit midi skirt metallic thread,10-15°C cool weather
women,SKIRTS,knit midi skirt,highwaist skirt feature elastic waistband vent hem,Bottom,knit skirt knit midi,knit skirt knit midi knit midi skirt,10-15°C cool weather
women,TROUSERS,knit striped culotte,highwaist trouser elastic waistband wideleg design,Bottom,knit trouser knit,knit trouser knit knit striped culotte,10-15°C cool weather
women,SKIRTS,knit semisheer straight skirt,highwaist skirt elastic waistbandthis garment line,Bottom,knit semisheer skirt knit,knit semisheer skirt knit knit semisheer straight skirt,10-15°C cool weather
women,TROUSERS,semisheer knit trouser,highwaist trouser feature elastic waistband adjustable drawstring elasticate cuff hemsthis garment line,Bottom,knit semisheer trouser knit,knit semisheer trouser knit semisheer knit trouser,10-15°C cool weather
women,SKIRTS,pointelle knit mini skirt,highwaist skirt feature adjustable elasticate waistband drawstring ruffle hem,Bottom,knit skirt knit mini,knit skirt knit mini pointelle knit mini skirt,10-15°C cool weather
women,SHORTS_SKORTS,open knit short,highwaist short elastic waistband,Bottom,knit short knit short,knit short knit short open knit short,10-15°C cool weather
women,SKIRTS,knit skirt buckle,highwaist skirt buckle crossover patch pocket flap buckle flare hem,Bottom,knit skirt knit,knit skirt knit knit skirt buckle,10-15°C cool weather
women,TROUSERS,straight fit knit trouser,highwaist trouser elastic waistband straightleg design,Bottom,knit trouser knit,knit trouser knit straight fit knit trouser,10-15°C cool weather
women,SKIRTS,long knit skirt fringing,highwaist skirt fringe hem,Bottom,knit skirt knit long,knit skirt knit long long knit skirt fringing,10-15°C cool weather
women,SKIRTS,knit skirt button,highwaist skirt elasticate waistband flap detail false button,Bottom,knit skirt knit,knit skirt knit knit skirt button,10-15°C cool weather
women,TROUSERS,metallic thread knit straight leg trouser,semisheer highwaist trouser elasticate waistband straightleg designthis garment line,Bottom,knit semisheer trouser knit,knit semisheer trouser knit metallic thread knit straight leg trouser,10-15°C cool weather
women,TROUSERS,pointelle knit trouser,highwaist trouser elastic waistband straightleg design,Bottom,knit trouser knit,knit trouser knit pointelle knit trouser,10-15°C cool weather
women,SKIRTS,knot knit skirt metallic thread,midi skirt knot slit hem metallic thread detail,Bottom,knit skirt knit midi,knit skirt knit midi knot knit skirt metallic thread,10-15°C cool weather
women,SKIRTS,knit cutout skirt,highwaist midi skirt feature elasticate waistband cutout detail rhinestone appliqué slit hem,Bottom,knit skirt knit midi,knit skirt knit midi knit cutout skirt,10-15°C cool weather
women,SKIRTS,knit crochet mini skirt,highwaist short skirt,Bottom,knit short skirt knit mini short,knit short skirt knit mini short knit crochet mini skirt,10-15°C cool weather
women,SHORTS_SKORTS,metallic thread knit short,highwaist short feature adjustable elastic waistband drawstre lining,Bottom,knit short knit short,knit short knit short metallic thread knit short,10-15°C cool weather
women,SKIRTS,tiedye knit midi skirt,highwaist pencil skirt elastic waistband,Bottom,knit pencil skirt knit midi,knit pencil skirt knit midi tiedye knit midi skirt,10-15°C cool weather
women,TROUSERS,fadedeffect plush trouser,fade cotton trouser feature elasticate drawstring waistband seamless hem,Bottom,cotton trouser,cotton trouser fadedeffect plush trouser,10-15°C cool weather
women,TROUSERS,fadedeffect rib trouser,fade highwaist trouser cotton blend feature elasticate waistband vent hem,Bottom,cotton trouser,cotton trouser fadedeffect rib trouser,10-15°C cool weather
women,TROUSERS,fadedeffect rip plush trouser,fadedeffect highwaist trouser cotton blend feature elasticate waistband rip detail,Bottom,cotton trouser,cotton trouser fadedeffect rip plush trouser,10-15°C cool weather
women,TROUSERS,wash effect trouser,fade lowrise trouser elasticate waistband pocket wideleg design,Bottom,trouser,trouser wash effect trouser,rain
women,SKIRTS,fadedeffect midi skirt,skirt faded cotton elasticate drawstring waistband slit hem,Bottom,cotton skirt midi,cotton skirt midi fadedeffect midi skirt,10-15°C cool weather
women,SHORTS,heavy cotton bermuda short,midrise bermuda short cotton blend feature elasticate drawstring waistband pocket,Bottom,cotton bermuda short short,cotton bermuda short short heavy cotton bermuda short,10-15°C cool weather
women,TROUSERS,carrot jogging trouser,highwaist trouser feature adjustable elastic waistband drawstring pocket,Bottom,trouser,trouser carrot jogging trouser,10-15°C cool weather
women,SHORTS_SKORTS,knit short,midrise short feature adjustable elasticate waistband drawstring,Bottom,knit short knit short,knit short knit short knit short,10-15°C cool weather
women,JEANS,z straightfit highwaist long length jean,highwaist regular reg long length rigid highwaist jean pocket fade effect straightleg longleg design zip fly button fasteningview,Bottom,jean long longleg,jean long longleg z straightfit highwaist long length jean,10-15°C cool weather
women,JEANS,z highwaist baggy paperbag jean,highrise baggy paperbag carrot leg ankle rigidhighwaist jean elasticate waistband gather detail feature pocket rear patch pocket turnup hem zip button fasten frontview,Bottom,jean,jean z highwaist baggy paperbag jean,10-15°C cool weather
women,SKIRTS,linen midi skirt,highwaist midi skirt linen flare hem invisible zip fastening,Bottom,linen skirt midi,linen skirt midi linen midi skirt,10-15°C cool weather
women,JEANS,trf loosefit midrise jean,loosefit midrise lengthmidrise jean fivepocket design long straight leg zip fly metal button fastening,Bottom,jean long,jean long trf loosefit midrise jean,10-15°C cool weather
women,SKIRTS,print midi skirt,highwaist midi skirt feature adjustable elastic waistband drawstring bead appliqué detail,Bottom,skirt midi,skirt midi print midi skirt,10-15°C cool weather
women,TROUSERS,shiny pyjamastyle trouser,midrise trouser elasticate waistband pocket metallic thread appliqué,Bottom,trouser,trouser shiny pyjamastyle trouser,10-15°C cool weather
women,TROUSERS,trf midrise cargo trouser,midrise trouser linen blend pocket patch pocket leg pocket false flap pocket zip fly metal button fastening,Bottom,linen trouser,linen trouser trf midrise cargo trouser,10-15°C cool weather
women,SKIRTS,print midi skirt,highwaist midi skirt cotton adjustable elasticate waistband drawstring,Bottom,cotton skirt midi,cotton skirt midi print midi skirt,10-15°C cool weather
women,TROUSERS,embroider culotte,highwaist trouser linen viscose blend rear patch pocket contrast embroidery zip fly button fastening,Bottom,linen viscose trouser,linen viscose trouser embroider culotte,10-15°C cool weather
women,TROUSERS,embroider linen blend trouser,highwaist trouser linen blend belt loop contrast embroidery zip fly button fastening,Bottom,linen belt trouser,linen belt trouser embroider linen blend trouser,10-15°C cool weather
women,SKIRTS,long linen blend skirt,highwaist long skirt linen blend fabric pocket flare hem zip button fastening,Bottom,linen skirt long,linen skirt long long linen blend skirt,10-15°C cool weather
women,JEANS,z midrise skinny jean,midrise skinny leg ankle stretchmidrise jean pocket fade effect zip fly metal button fasteningview,Bottom,jean,jean z midrise skinny jean,10-15°C cool weather
women,TROUSERS,flare length trouser,highwaist trouser feature false welt pocket flare hem zip fly interior button metal hook fasten,Bottom,trouser,trouser flare length trouser,10-15°C cool weather
women,TROUSERS,carrot fit poplin trouser,highwaist crop trouser feature elastic waistband drawstre pocket rear patch pocket,Bottom,poplin trouser crop,poplin trouser crop carrot fit poplin trouser,10-15°C cool weather
women,TROUSERS,print ramie trouser,highwaist trouser ramie wideleg design invisible zip fastening,Bottom,ramie trouser,ramie trouser print ramie trouser,10-15°C cool weather
women,TROUSERS,print straightcut trouser,midrise trouser cotton belt loop patch pocket straightleg design zip fly button fastening,Bottom,cotton belt trouser,cotton belt trouser print straightcut trouser,10-15°C cool weather
women,SKIRTS,linen blend midi skirt,highwaist midi skirt linen blend false welt pocket slit hem invisible zip fastening,Bottom,linen skirt midi,linen skirt midi linen blend midi skirt,10-15°C cool weather
women,TROUSERS,cotton blend pyjamastyle trouser,midrise trouser lyocell cotton blend elasticate waistband pocket welt pocket rear straightleg design,Bottom,cotton lyocell trouser,cotton lyocell trouser cotton blend pyjamastyle trouser,10-15°C cool weather
women,TROUSERS,length linen blend trouser,highwaist trouser linen blend pocket patch pocket zip fly inside button metal hook fasten,Bottom,linen trouser,linen trouser length linen blend trouser,10-15°C cool weather
women,TROUSERS,fray linen trouser,midrise trouser linen belt loop pocket false welt pocket fray hem zip fly button fastening,Bottom,linen belt trouser,linen belt trouser fray linen trouser,10-15°C cool weather
women,TROUSERS,length linen blend trouser,highwaist trouser linen blend pocket rear false welt pocket dart detail zip fly inside button metal hook fasten,Bottom,linen trouser,linen trouser length linen blend trouser,10-15°C cool weather
women,TROUSERS,long flow trouser,loosefitte highwaist trouser straightleg design invisible zip fastening,Bottom,trouser long,trouser long long flow trouser,10-15°C cool weather
women,TROUSERS,texture jacquard trouser,highwaist trouser inner elasticate waistband texture fabric detail wideleg design,Bottom,trouser,trouser texture jacquard trouser,10-15°C cool weather
women,TROUSERS,highwaist culotte trouser,highwaist trouser feature pocket rear welt pocket short wide leg design zip fly interior button metal hook fasten,Bottom,short trouser short,short trouser short highwaist culotte trouser,10-15°C cool weather
women,TROUSERS,minimalist palazzo trouser,semisheer trouser viscose blend elasticate waistband pocket hide seam line wide leg,Bottom,semisheer viscose trouser,semisheer viscose trouser minimalist palazzo trouser,10-15°C cool weather
women,TROUSERS,stripe palazzo trouser,highwaist trouser elastic waistband wideleg design,Bottom,trouser,trouser stripe palazzo trouser,10-15°C cool weather
women,TROUSERS,animal print flare trouser,flow highwaist trouser flare hem zip fly inside button metal hook fasten,Bottom,trouser,trouser animal print flare trouser,10-15°C cool weather
women,TROUSERS,straight fit trouser topstitching,midrise trouser belt loop pocket false welt pocket contrast topstitche detail zip button fastening,Bottom,belt trouser,belt trouser straight fit trouser topstitching,10-15°C cool weather
women,TROUSERS,flow wideleg trouser,midwaist trouser feature elasticate waistband adjustable drawstring wideleg design,Bottom,trouser,trouser flow wideleg trouser,10-15°C cool weather
women,SKIRTS,linen blend crossover skirt,midi skirt linen blend feature asymmetric waist belt loop welt pocket button fastening,Bottom,linen belt skirt midi,linen belt skirt midi linen blend crossover skirt,10-15°C cool weather
women,TROUSERS,sequinne satin trouser,highwaist trouser viscose elastic waistband adjustable drawstring pocket rear patch pocket embroidery detail sequin appliqués straightleg design,Bottom,satin viscose trouser,satin viscose trouser sequinne satin trouser,10-15°C cool weather
women,TROUSERS,straightleg trouser turnup hem,highwaist trouser feature pocket rear false welt pocket straightleg design turnup hem zip fly interior button metal hook fasten,Bottom,trouser,trouser straightleg trouser turnup hem,10-15°C cool weather
women,TROUSERS,wideleg poplin trouser,midrise trouser cotton elasticate waistband adjustable drawstring inseam pocket wideleg design,Bottom,cotton poplin trouser,cotton poplin trouser wideleg poplin trouser,10-15°C cool weather
women,TROUSERS,satin cargo trouser,highwaist trouser feature elasticate waistband pocket patch pocket flap straightleg design zip fly interior button metal hook fasten,Bottom,satin trouser,satin trouser satin cargo trouser,10-15°C cool weather
women,TROUSERS,creasedeffect satin trouser,highwaist trouser elasticate waistband pocket straight leg,Bottom,satin trouser,satin trouser creasedeffect satin trouser,10-15°C cool weather
women,TROUSERS,linen trouser,midrise trouser linen belt loop pocket fray hem zip fly button fastening,Bottom,linen belt trouser,linen belt trouser linen trouser,10-15°C cool weather
men,TROUSERS,linen pleated trouser,regular fit trouser linen fabric waistband pleated detail pocket rear jetted pocket zip fly button fasteningorigin special collectionview,Bottom,linen trouser,linen trouser linen pleated trouser,10-15°C cool weather
men,JEANS,regular fit jean,regular fit jean cotton denim pocket fade effect buttonup frontorigin special collection,Bottom,cotton denim denim jean,cotton denim denim jean regular fit jean,10-15°C cool weather
men,TROUSERS,linen suit trouser,straight fit trouser linen pocket button jetted pocket zip fly button fastening,Bottom,linen suit trouser,linen suit trouser linen suit trouser,10-15°C cool weather
men,TROUSERS,widefit knit jogger,knit trouser adjustable elasticate waistband pocket rear pocket detail,Bottom,knit trouser knit,knit trouser knit widefit knit jogger,10-15°C cool weather
men,TROUSERS,rib jogger,trouser feature adjustable elasticate waistband drawstre pocket rear pocket detail,Bottom,trouser,trouser rib jogger,10-15°C cool weather
men,TROUSERS,slim fit cargo trouser,slim fit trouser pocket rear pocket detail patch pocket flap leg zip fly button fastening,Bottom,trouser,trouser slim fit cargo trouser,10-15°C cool weather
men,TROUSERS,straight fit cargo trouser,straight fit trouser pocket flap pocket patch pocket flap leg adjustable hem tab zip fly button fastening,Bottom,trouser,trouser straight fit cargo trouser,10-15°C cool weather
men,TROUSERS,pleated trouser,relaxed fit trouser waistband pleated detail pocket rear welt pocket zip fly button fastening,Bottom,trouser,trouser pleated trouser,10-15°C cool weather
men,TROUSERS,pleated trouser belt,relaxed fit trouser feature waist pleat belt fabric pocket rear welt pocket zip button fastening,Bottom,belt trouser,belt trouser pleated trouser belt,10-15°C cool weather
men,TROUSERS,comfort fit jogger waist trouser,trouser stretchy fabric adjustable inner elasticate waistband pocket,Bottom,trouser,trouser comfort fit jogger waist trouser,10-15°C cool weather
men,TROUSERS,relaxedfit trouser pleat,relaxedfit trouser waistband pleated detail pocket rear pocket buttoned flap zip fly button fastening,Bottom,trouser,trouser relaxedfit trouser pleat,10-15°C cool weather
men,TROUSERS,pleated trouser,straight fit trouser waist pleated detail pocket rear pocket detail turnup hem zip fly button fastening,Bottom,trouser,trouser pleated trouser,10-15°C cool weather
men,TROUSERS,wool suit trouser limited edition,relaxed fit trouser elasticate waistband pleated detail pocket rear jetted pocket hide metal hook zip fly fastening,Bottom,wool suit trouser,wool suit trouser wool suit trouser limited edition,10-15°C cool weather
men,TROUSERS,wool suit trouser,slimfit trouser italian wool fabric pocket welt pocket button hide metal hook zip fly fasten,Bottom,wool suit trouser,wool suit trouser wool suit trouser,10-15°C cool weather
men,TROUSERS,wool suit trouser,slim fit trouser italian wool fabric pocket rear welt pocket zip fly crossover button fastening,Bottom,wool suit trouser,wool suit trouser wool suit trouser,10-15°C cool weather
men,TROUSERS,technical training trouser,trouser lightweight stretchy technical fabric elastic waistband drawstring pocket autolock zip fasten hem elasticate cuff print logo detailzara athleticzview,Bottom,trouser lightweight,trouser lightweight technical training trouser,10-15°C cool weather
men,TROUSERS,jogger waist cotton trouser,trouser compact cotton fabric adjustable elastic waistband drawstre welt pocket zip closure cuff hemszara athleticzview,Bottom,cotton trouser,cotton trouser jogger waist cotton trouser,10-15°C cool weather
