gender,product_category,product_name,details,category_type,combined_features,text,weather_label
women,SKIRTS,z denim midi skirt,fade highwaist skirt feature fivepocket design vent hem button fastening,Bottom,denim denim skirt midi,denim denim skirt midi z denim midi skirt,10-15°C cool weather
women,SKIRTS,faux leather mini skirt chain,highwaist mini skirt lining metal chain link invisible zip fastening,Bottom,faux leather skirt mini,faux leather skirt mini faux leather mini skirt chain,10-15°C cool weather
women,SKIRTS,skort pocket,midwaist skort adjustable elasticate waistband drawstring stopper patch pocket,Bottom,skort,skort skort pocket,5-10°C cold weather
women,SKIRTS,long satin skirt,long skirt high elastic waist,Bottom,satin skirt long,satin skirt long long satin skirt,10-15°C cool weather
women,SKIRTS,knot midi skirt,highwaist flow midi skirt knot detail slit hem invisible zip fastening,Bottom,skirt midi,skirt midi knot midi skirt,10-15°C cool weather
women,SKIRTS,linen blend crossover skirt,midi skirt linen blend feature asymmetric waist belt loop welt pocket button fastening,Bottom,linen belt skirt midi,linen belt skirt midi linen blend crossover skirt,10-15°C cool weather
women,SKIRTS,knit midi skirt metallic thread,highwaist skirt elastic waistband slit hem metallic thread detail,Bottom,knit skirt knit midi,knit skirt knit midi knit midi skirt metallic thread,10-15°C cool weather
women,SKIRTS,long denim skirt,womanhighwaist long skirt belt loop pocket fade effect visible contrast topstitche detail seamless hem opening invisible zip fastening,Bottom,denim belt denim skirt long,denim belt denim skirt long long denim skirt,10-15°C cool weather
women,SKIRTS,highwaist denim skirt slit,womanfade highwaist long skirt belt loop fivepocket design fray split hem zip fly button fastening,Bottom,denim belt denim skirt long,denim belt denim skirt long highwaist denim skirt slit,10-15°C cool weather
women,SKIRTS,long print skirt,highwaist skirt feature elasticate waistband matching thin belt tassel,Bottom,belt skirt long,belt skirt long long print skirt,10-15°C cool weather
women,SKIRTS,long skirt slit,long highwaist skirt crease fabric detail flare hem slit,Bottom,skirt long,skirt long long skirt slit,10-15°C cool weather
women,SKIRTS,rustic texture skirt,midrise midi skirt cotton linen blend adjustable drawstring waist fray trim flare hem,Bottom,cotton linen skirt midi,cotton linen skirt midi rustic texture skirt,10-15°C cool weather
women,SKIRTS,satin pleated skirt,highwaist midi skirt invisible zip fastening,Bottom,satin skirt midi,satin skirt midi satin pleated skirt,10-15°C cool weather
women,SKIRTS,faux leather skirt pocket,midwaist mini skirt belt loop patch pocket zip fly metal hook fasten,Bottom,faux leather belt skirt mini,faux leather belt skirt mini faux leather skirt pocket,10-15°C cool weather
women,SKIRTS,knit cutout skirt,highwaist midi skirt feature elasticate waistband cutout detail rhinestone appliqué slit hem,Bottom,knit skirt knit midi,knit skirt knit midi knit cutout skirt,10-15°C cool weather
women,SKIRTS,pointelle knit mini skirt,highwaist skirt feature adjustable elasticate waistband drawstring ruffle hem,Bottom,knit skirt knit mini,knit skirt knit mini pointelle knit mini skirt,10-15°C cool weather
women,SKIRTS,trf asymmetric denim metallic skirt,highwaist midi skirt feature asymmetric waist belt loop pocket metallic fabric detail fray hem slit zip button fasten,Bottom,denim belt denim skirt midi,denim belt denim skirt midi trf asymmetric denim metallic skirt,10-15°C cool weather
women,SKIRTS,midi skirt gather detail,highwaist midi skirt twist fabric tie detail hem crossover open invisible zip fastening,Bottom,skirt midi,skirt midi midi skirt gather detail,10-15°C cool weather
women,SKIRTS,midi pencil skirt,highwaist midi skirt welt pocket slit hem fasten metal hook inside button zip,Bottom,pencil skirt midi,pencil skirt midi midi pencil skirt,10-15°C cool weather
women,SKIRTS,long denim trf skirt,midwaist long skirt pocket feature seamless hem slit crossover fasten inside button zip metal button,Bottom,denim denim skirt long,denim denim skirt long long denim trf skirt,10-15°C cool weather
women,SKIRTS,skort slit detail,highwaist skort feature slit invisible zip fastening,Bottom,skort,skort skort slit detail,5-10°C cold weather
women,SKIRTS,asymmetric skort,find,Bottom,skort,skort asymmetric skort,10-15°C cool weather
women,SKIRTS,voluminous midi skirt,highwaist midi skirt elastic waist pocket pleated detail,Bottom,skirt midi,skirt midi voluminous midi skirt,10-15°C cool weather
women,SKIRTS,box pleat skort,highwaist skort pleat false golden button invisible zip fastening,Bottom,box skort,box skort box pleat skort,10-15°C cool weather
women,SKIRTS,denim trf skirt,midrise long skirt fivepocket design fade effect zip fly metal button fastening,Bottom,denim denim skirt long,denim denim skirt long denim trf skirt,10-15°C cool weather
women,SKIRTS,satin midi skirt,highwaist skirt elastic waistband,Bottom,satin skirt midi,satin skirt midi satin midi skirt,10-15°C cool weather
women,SKIRTS,z crossover skort button,highwaist skort crossover pocket rear patch pocket seamless hem fasten hidden zip button,Bottom,skort,skort z crossover skort button,5-10°C cold weather
women,SKIRTS,denim trf cargo skirt,midwaist short skirt pocket patch pocket false flap pocket zip fly metal button fastening,Bottom,denim denim short skirt short,denim denim short skirt short denim trf cargo skirt,10-15°C cool weather
women,SKIRTS,long denim trf skirt,midwaist long skirt pocket feature seamless hem slit fasten zip metal button,Bottom,denim denim skirt long,denim denim skirt long long denim trf skirt,10-15°C cool weather
women,SKIRTS,long linen skirt,long midrise skirt linen feature adjustable drawstring fabric flare hem fray trim,Bottom,linen skirt long,linen skirt long long linen skirt,10-15°C cool weather
women,SKIRTS,sequinne miniskirt,midrise mini skirt contrast bead sequin detail matching line invisible zip fastening,Bottom,skirt mini,skirt mini sequinne miniskirt,10-15°C cool weather
women,SKIRTS,z denim midi skirt slit,highwaist skirt pocket seamless hem slit zip button fastening,Bottom,denim denim skirt midi,denim denim skirt midi z denim midi skirt slit,10-15°C cool weather
women,SKIRTS,asymmetric skort,highwaist skort false welt pocket layered wrap detail match fabric invisible zip fastening,Bottom,skort,skort asymmetric skort,10-15°C cool weather
women,SKIRTS,z denim midi skirt slit,fade highwaist skirt fivepocket design feature vent hem zip fly metal button fastening,Bottom,denim denim skirt midi,denim denim skirt midi z denim midi skirt slit,10-15°C cool weather
women,SKIRTS,skort belt,highwaist skort belt detail fabric lined buckle hem vent invisible zip fastening,Bottom,belt skort,belt skort skort belt,10-15°C cool weather
women,SKIRTS,print drape skirt,print highwaist midi skirt elasticate interior waist drape fabric detail slit hem,Bottom,skirt midi,skirt midi print drape skirt,10-15°C cool weather
women,SKIRTS,asymmetric crochet skirt,highwaist crochet midi skirt feature elastic waist matching lining asymmetric hem,Bottom,skirt midi,skirt midi asymmetric crochet skirt,10-15°C cool weather
women,SKIRTS,skort bow,highwaist skort matching bow ruffle hem invisible zip fastening,Bottom,bow skort,bow skort skort bow,10-15°C cool weather
women,SKIRTS,gather organza midi skirt,highwaist midi skirt elastic waistband gather fabric detail matching line seamless hem,Bottom,organza skirt midi,organza skirt midi gather organza midi skirt,10-15°C cool weather
women,SKIRTS,trf denim box pleat skirt,midwaist mini skirt feature pocket box pleat hem rip detail hem zip fly metal button fastening,Bottom,denim box denim skirt mini,denim box denim skirt mini trf denim box pleat skirt,10-15°C cool weather
women,SKIRTS,cargo skort belt,midrise skort patch pocket detail invisible zip fastening belt metal buckle,Bottom,belt skort,belt skort cargo skort belt,10-15°C cool weather
women,SKIRTS,print midi skirt,highwaist midi skirt pleated detail waist invisible zip fastening,Bottom,skirt midi,skirt midi print midi skirt,10-15°C cool weather
women,SKIRTS,asymmetric fray skirt,womanmidrise midi skirt feature asymmetric waistband belt loop pocket asymmetric hem slit zip button fastening,Bottom,belt skirt midi,belt skirt midi asymmetric fray skirt,10-15°C cool weather
women,SKIRTS,linen blend highwaist skort,highwaist skort belt loop linen blend fabric pocket false rear welt pocket zip interior button metal hook fasten,Bottom,linen belt skort,linen belt skort linen blend highwaist skort,10-15°C cool weather
women,SKIRTS,sequinne midi skirt,highwaist semisheer skirt elastic waistband vent hem seamless trim match lining,Bottom,semisheer skirt midi,semisheer skirt midi sequinne midi skirt,10-15°C cool weather
women,SKIRTS,midi skirt slit,highwaist midi skirt slit detail hem invisible zip fastening,Bottom,skirt midi,skirt midi midi skirt slit,10-15°C cool weather
women,SKIRTS,denim mini skirt,womanshort highwaist skirt double waistband detail fray hem zip button fasten,Bottom,denim denim skirt mini,denim denim skirt mini denim mini skirt,10-15°C cool weather
women,SKIRTS,z crossover denim midi skirt,highwaist skirt patch pocket slit hem crossover metal button fasten,Bottom,denim denim skirt midi,denim denim skirt midi z crossover denim midi skirt,10-15°C cool weather
women,SKIRTS,skort slit detail,highwaist skort slit invisible zip fastening,Bottom,skort,skort skort slit detail,5-10°C cold weather
women,SKIRTS,z denim cape skirt,highwaist midi skirt belt loop flare hem fade effect zip fly metal button fastening,Bottom,denim belt cape denim skirt midi,denim belt cape denim skirt midi z denim cape skirt,10-15°C cool weather
women,SKIRTS,print mini skirt fringing,highwaist skirt knot detail trim feature fringing bead appliqués invisible zip fastening,Bottom,skirt mini,skirt mini print mini skirt fringing,10-15°C cool weather
women,SKIRTS,linen blend skort,highwaist skort linen blend pocket false welt pocket zip fly inside button metal hook fasten,Bottom,linen skort,linen skort linen blend skort,10-15°C cool weather
women,SKIRTS,cargo mini skirt,midrise mini skirt belt loop patch pocket flap detail zip fly button fastening,Bottom,belt skirt mini,belt skirt mini cargo mini skirt,10-15°C cool weather
women,SKIRTS,long skirt rubberise waistband,highwaist skirt wide elastic waistband lining,Bottom,rubberise skirt long,rubberise skirt long long skirt rubberise waistband,10-15°C cool weather
women,SKIRTS,embroider linen blend skirt,highwaist skirt linen viscose blend inseam pocket contrast floral embroidery detail fasten zip fly button shape flower,Bottom,linen viscose skirt,linen viscose skirt embroider linen blend skirt,10-15°C cool weather
women,SKIRTS,embroidered midi skirt limited edition,highwaist midi skirt feature embroider ruffle bead appliqué,Bottom,skirt midi,skirt midi embroidered midi skirt limited edition,10-15°C cool weather
women,SKIRTS,cargo mini skirt,midwaist mini skirt pocket patch pocket leg zip metal button fastening,Bottom,skirt mini,skirt mini cargo mini skirt,10-15°C cool weather
women,SKIRTS,linen blend buttoned midi skirt,highwaist skirt linen cotton blend false button slit hem invisible zip fastening,Bottom,cotton linen skirt midi,cotton linen skirt midi linen blend buttoned midi skirt,10-15°C cool weather
women,SKIRTS,z denim midi skirt zip,highwaist skirt pocket fade effect slit hem zip fasten,Bottom,denim denim skirt midi,denim denim skirt midi z denim midi skirt zip,10-15°C cool weather
women,JEANS,marine straight fit highwaist pocket jean,slim fit relaxed leg high waistzw woman jeanshighwaist jean belt loop patch pocket contrast visible topstitche detail seamless hem zip fly button fastening,Bottom,belt jean,belt jean marine straight fit highwaist pocket jean,10-15°C cool weather
women,JEANS,marine straightleg highwaist jean,slim fit relaxed leg high waistzw woman jeanshighwaist jean patch pocket seamless hem zip fly button fastening,Bottom,jean,jean marine straightleg highwaist jean,10-15°C cool weather
women,TROUSERS,highwaist culotte trouser,highwaist trouser feature pocket rear welt pocket short wide leg design zip fly interior button metal hook fasten,Bottom,short trouser short,short trouser short highwaist culotte trouser,10-15°C cool weather
women,TROUSERS,cropped trouser,highwaist crop trouser elasticate waistband drawstre dart pocket,Bottom,trouser crop cropped,trouser crop cropped cropped trouser,10-15°C cool weather
women,TROUSERS,carrot fit trouser dart detail,midwaist trouser viscose blend belt loop pocket rear welt pocket dart detail pleated hem contrast button zip fly button fastening,Bottom,viscose belt trouser,viscose belt trouser carrot fit trouser dart detail,10-15°C cool weather
women,SHORTS_SKORTS,trf highrise mom fit denim bermuda short,highrise mom fithighrise bermuda short fivepocket design zip fly metal button fasten turnup hem,Bottom,denim bermuda denim short short,denim bermuda denim short short trf highrise mom fit denim bermuda short,10-15°C cool weather
women,TROUSERS,length trouser,pleated highwaist trouser pocket zip fly inside button metal hook fasten,Bottom,trouser,trouser length trouser,10-15°C cool weather
women,JEANS,highrise stove pipe trf jean,highwaist slim ankle lengthhighwaist jean fivepocket design zip fly metal button fastening,Bottom,jean,jean highrise stove pipe trf jean,10-15°C cool weather
women,JEANS,trf wideleg midrise length jean,midrise wideleg lengthmidrise rigid jean fivepocket design long wide leg zip fly metal button fastening,Bottom,jean long,jean long trf wideleg midrise length jean,10-15°C cool weather
women,TROUSERS,highwaist trouser,highwaist trouser seam detail welt pocket zip fly inside button metal hook fasten,Bottom,trouser,trouser highwaist trouser,10-15°C cool weather
women,TROUSERS,wide waistband legging,highwaist legging wide elastic waistband,Bottom,, wide waistband legging,10-15°C cool weather
women,TROUSERS,pleated satinfinish trouser,trouser pleated satin fabric elastic drawstring waistband wideleg design,Bottom,satin trouser,satin trouser pleated satinfinish trouser,10-15°C cool weather
women,TROUSERS,print foil trouser,highwaist trouser elasticate waistband adjustable drawstring metallic print detail,Bottom,trouser,trouser print foil trouser,10-15°C cool weather
women,TROUSERS,foil trouser,highwaist trouser metallic satin fabric feature elastic waistband inseam pocket,Bottom,satin trouser,satin trouser foil trouser,10-15°C cool weather
women,TROUSERS,body shaping legging,highwaist legging fit elasticate waistband invisible zip fastening,Bottom,, body shaping legging,10-15°C cool weather
women,TROUSERS,highwaist denim legging button,highwaist denim legging elastic waistband snapbutton zip fasten,Bottom,denim denim,denim denim highwaist denim legging button,10-15°C cool weather
women,TROUSERS,highwaist legging button,highwaist legging feature elasticate waistband raise golden button,Bottom,, highwaist legging button,10-15°C cool weather
women,TROUSERS,highwaist trouser,highwaist trouser seam detail welt pocket zip fly inside button metal hook fasten,Bottom,trouser,trouser highwaist trouser,10-15°C cool weather
women,TROUSERS,high waiste carrot trouser,highwaist trouser pocket patch pocket leg pocket belt loop metal buckle zip inside button fastening,Bottom,belt trouser,belt trouser high waiste carrot trouser,10-15°C cool weather
women,TROUSERS,knit striped culotte,highwaist trouser elastic waistband wideleg design,Bottom,knit trouser knit,knit trouser knit knit striped culotte,10-15°C cool weather
women,TROUSERS,barrel trouser cuff hem,highwaist trouser feature pocket false welt pocket hem dart detail zip fly button fastening,Bottom,trouser,trouser barrel trouser cuff hem,10-15°C cool weather
women,TROUSERS,satin cargo trouser,midrise satin trouser viscose belt loop pocket multiple patch pocket flap straight leg zip button fastening,Bottom,satin viscose belt trouser,satin viscose belt trouser satin cargo trouser,10-15°C cool weather
women,TROUSERS,print wrap trouser,highwaist trouser knot straightleg design,Bottom,trouser,trouser print wrap trouser,10-15°C cool weather
women,TROUSERS,long flow trouser,loosefitte highwaist trouser straightleg design invisible zip fastening,Bottom,trouser long,trouser long long flow trouser,10-15°C cool weather
women,TROUSERS,straightleg trouser turnup hem,highwaist trouser feature pocket rear false welt pocket straightleg design turnup hem zip fly interior button metal hook fasten,Bottom,trouser,trouser straightleg trouser turnup hem,10-15°C cool weather
women,TROUSERS,wideleg trouser zips,midrise trouser belt loop inseam zip pocket rear welt pocket match visible topstitche wide leg zipup,Bottom,belt trouser,belt trouser wideleg trouser zips,10-15°C cool weather
women,TROUSERS,flare length trouser,highwaist trouser pocket false welt pocket flare hem zip fly interior button metal hook fasten,Bottom,trouser,trouser flare length trouser,10-15°C cool weather
women,TROUSERS,crop straightfit satin trouser,midrise trouser adjustable elasticate waistband drawstring,Bottom,satin trouser crop,satin trouser crop crop straightfit satin trouser,10-15°C cool weather
women,TROUSERS,metallic print trouser,midwaist flow trouser elasticate waistband adjustable drawstring metallic print detail,Bottom,trouser,trouser metallic print trouser,10-15°C cool weather
women,TROUSERS,highrise straightfit trf cargo trouser,highwaist trouser patch pocket side leg false pocket flap zip fly metal button fastening,Bottom,trouser,trouser highrise straightfit trf cargo trouser,10-15°C cool weather
women,TROUSERS,flare highwaist legging,high waist flare leg length comforthighwaist legging elastic waistband long flare hem,Bottom,long,long flare highwaist legging,10-15°C cool weather
women,TROUSERS,paperbag trouser belt,highwaist trouser dart pocket patch pocket flap adjustable hem button fasten zip fly interior button metal hook fasten belt buckle metal stud,Bottom,belt trouser,belt trouser paperbag trouser belt,10-15°C cool weather
women,TROUSERS,texture jacquard trouser,highwaist trouser inner elasticate waistband texture fabric detail wideleg design,Bottom,trouser,trouser texture jacquard trouser,10-15°C cool weather
women,TROUSERS,trouser lined belt,highwaist crop trouser dart matching line belt pocket false rear welt pocket zip fly interior button metal hook fasten,Bottom,belt trouser crop,belt trouser crop trouser lined belt,10-15°C cool weather
women,TROUSERS,flare trouser,midrise trouser flare hem zip fly interior button metal hook fasten,Bottom,trouser,trouser flare trouser,10-15°C cool weather
women,TROUSERS,sequinne satin trouser,highwaist trouser viscose elastic waistband adjustable drawstring pocket rear patch pocket embroidery detail sequin appliqués straightleg design,Bottom,satin viscose trouser,satin viscose trouser sequinne satin trouser,10-15°C cool weather
women,TROUSERS,highwaist slim fit trouser,highwaist trouser belt loop pocket rear false welt pocket pronounce seam zip fly inside button metal hook fasten,Bottom,belt trouser,belt trouser highwaist slim fit trouser,10-15°C cool weather
women,TROUSERS,length linen blend trouser,highwaist trouser linen blend pocket rear false welt pocket dart detail zip fly inside button metal hook fasten,Bottom,linen trouser,linen trouser length linen blend trouser,10-15°C cool weather
women,TROUSERS,belt cargo trouser,highwaist trouser feature matching belt pocket false rear welt pocket zip fly metal hook fasten,Bottom,belt trouser,belt trouser belt cargo trouser,10-15°C cool weather
women,TROUSERS,satin cargo trouser,highwaist trouser feature elasticate waistband pocket patch pocket flap straightleg design zip fly interior button metal hook fasten,Bottom,satin trouser,satin trouser satin cargo trouser,10-15°C cool weather
women,TROUSERS,highwaist culotte trouser,highwaist trouser feature pocket rear welt pocket short wide leg design zip fly interior button metal hook fasten,Bottom,short trouser short,short trouser short highwaist culotte trouser,10-15°C cool weather
women,TROUSERS,trf cargo topstitche trouser,highwaist trouser feature adjustable elasticate waistband drawstring patch pocket pocket leg false flap pocket adjustable drawstre hem contrast seam detail,Bottom,trouser,trouser trf cargo topstitche trouser,10-15°C cool weather
women,TROUSERS,print palazzo ramie trouser,midrise trouser ramie adjustable elasticate waistband drawstring inseam pocket wideleg design,Bottom,ramie trouser,ramie trouser print palazzo ramie trouser,10-15°C cool weather
women,TROUSERS,contrast boxer trouser,highwaist trouser pocket rear welt pocket fabric interior elasticate waistband straight leg,Bottom,trouser,trouser contrast boxer trouser,10-15°C cool weather
women,TROUSERS,wideleg poplin trouser,midrise trouser cotton elasticate waistband adjustable drawstring inseam pocket wideleg design,Bottom,cotton poplin trouser,cotton poplin trouser wideleg poplin trouser,10-15°C cool weather
women,TROUSERS,flow wrap trouser,midwaist flow trouser elasticate waistband feature wrapstyle layer detail fabric adjustable tie wideleg design,Bottom,trouser,trouser flow wrap trouser,10-15°C cool weather
women,TROUSERS,belt cargo trouser,highwaist trouser dart belt fabric pocket patch pocket flap hem adjustable tab zip fly metal hook fasten,Bottom,belt trouser,belt trouser belt cargo trouser,10-15°C cool weather
women,TROUSERS,contrast patchwork trouser,highwaist trouser feature adjustable waistband drawstring contrast fabric wideleg design,Bottom,trouser,trouser contrast patchwork trouser,10-15°C cool weather
women,TROUSERS,texture jacquard trouser,highwaist trouser adjustable waistband matching drawstring texture jacquard fabric detail wideleg design,Bottom,trouser,trouser texture jacquard trouser,10-15°C cool weather
women,TROUSERS,linen trouser,midrise trouser linen belt loop pocket fray hem zip fly button fastening,Bottom,linen belt trouser,linen belt trouser linen trouser,10-15°C cool weather
women,TROUSERS,carrot jogging trouser,highwaist trouser feature adjustable elastic waistband drawstring pocket,Bottom,trouser,trouser carrot jogging trouser,10-15°C cool weather
women,TROUSERS,paperbag trouser belt,highwaist trouser dart matching belt pocket wideleg design zip interior button metal hook fasten,Bottom,belt trouser,belt trouser paperbag trouser belt,10-15°C cool weather
women,TROUSERS,embroider trouser,midrise trouser viscose blend adjustable waistband drawstring contrast embroidery detail,Bottom,viscose trouser,viscose trouser embroider trouser,10-15°C cool weather
women,TROUSERS,cargo trouser elasticate waistband,highwaist trouser feature elasticate waistband drawstring pocket patch pocket flap cuff elasticate hem,Bottom,trouser,trouser cargo trouser elasticate waistband,10-15°C cool weather
women,TROUSERS,straight fit trouser button,highwaist trouser elastic waistband pocket decorative golden button false welt pocket straightleg design,Bottom,trouser,trouser straight fit trouser button,10-15°C cool weather
women,TROUSERS,print ramie trouser,midwaist trouser ramie elasticate waistband adjustable drawstring match fabric pocket wideleg design,Bottom,ramie trouser,ramie trouser print ramie trouser,10-15°C cool weather
women,TROUSERS,highwaist carrot fit trouser dart,highwaist trouser dart inseam pocket zip interior button metal hook fasten,Bottom,trouser,trouser highwaist carrot fit trouser dart,10-15°C cool weather
women,TROUSERS,creasedeffect satin trouser,highwaist trouser elasticate waistband pocket straight leg,Bottom,satin trouser,satin trouser creasedeffect satin trouser,10-15°C cool weather
women,TROUSERS,wideleg pyjamastyle trouser,highwaist trouser elasticate drawstring waistband pocket wideleg design,Bottom,trouser,trouser wideleg pyjamastyle trouser,10-15°C cool weather
women,TROUSERS,carrot fit trouser tab hem,highwaist trouser elasticate waistband pocket visible seam detail hem buttoned tab,Bottom,trouser,trouser carrot fit trouser tab hem,10-15°C cool weather
women,TROUSERS,belt chino trouser,highwaist trouser dart pocket button false welt pocket zip fly button fasten embossed belt detail,Bottom,belt chino trouser,belt chino trouser belt chino trouser,10-15°C cool weather
women,TROUSERS,nylon trouser zips,midrise trouser feature adjustable elasticate waistband drawstring pocket patch pocket flap leg elasticate hem zip,Bottom,nylon trouser,nylon trouser nylon trouser zips,10-15°C cool weather
women,TROUSERS,length trouser,pleated highwaist trouser pocket zip fly inside button metal hook fasten,Bottom,trouser,trouser length trouser,10-15°C cool weather
women,TROUSERS,basic flow trouser,flow highwaist trouser elastic waistband,Bottom,trouser,trouser basic flow trouser,10-15°C cool weather
women,TROUSERS,nylon blend parachute trouser,midrise trouser pocket false rear welt pocket pleat detail knee adjustable stopper hem,Bottom,nylon trouser,nylon trouser nylon blend parachute trouser,10-15°C cool weather
women,TROUSERS,linen blend carrot fit trouser,highwaist trouser linen blend feature elasticate waistband adjustable drawstring rear patch pocket,Bottom,linen trouser,linen trouser linen blend carrot fit trouser,10-15°C cool weather
women,TROUSERS,finely pleated palazzo trouser,highwaist trouser elasticate waistband line wideleg design,Bottom,trouser,trouser finely pleated palazzo trouser,10-15°C cool weather
women,TROUSERS,wideleg fray trouser,highwaist trouser pocket wideleg design fray trim detail zip fly button fastening,Bottom,trouser,trouser wideleg fray trouser,10-15°C cool weather
